Name,Description,Latitude,Longitude,InfoURL,ImageURL
UCSB,A great university located along the California coast!,34.416929,-119.845991,"https://en.wikipedia.org/wiki/University_of_California, _Santa_Barbara",https://www.history.ucsb.edu/wp-content/uploads/La goonFall20141.jpg
Rincon,One of the greatest waves in the world! Offten refured to as the queen of the coast because of its beautiful and world class waves ,34.372739,-119.477176,https://en.wikipedia.org/wiki/Rincon_(surfspot),https://cbcmsurf.files.wordpress.com/2015/08/rincon-santa-barbara-surf-spot.jpg
La Cumbre Peak,The tallest point in Santa Barbara.  A popular hiking location and one of the most beautiful spots in Santa Barbara ,34.49496,-119.71389,https://en.wikipedia.org/wiki/La_Cumbre_Peak,https://www.edhat.com/sites/default/files/news_image/dsc_0625.jpg
Emerald Bay Tahoe,Considered to be the crown jewl of Lake Tahoe.  A prestine blue bay in South Lake Tahoe that attracts people from all over to see.,38.95599,-120.092166,https://tahoesouth.com/emerald-bay/,https://tahoesouth.com/wp-content/uploads/2017/03/Emerald-Bay-Sunburst-1024x448.jpg
Mammoth Mountain,"An amazing mountain for winter activites such as skiing and snowboarding, but also a great location to visit over summer!",37.630768,-119.032631,https://en.wikipedia.org/wiki/Mammoth_Mountain,https://st.focusedcollection.com/15113232/i/650/focused_175143872-stock-photo-winter-road-leading-fresh-snow.jpg
Yosemite,A breathtaking place to visit and explore.  No words can describe the beauty of this place.,37.865101,-119.53833,https://www.nps.gov/yose/index.htm,https://www.cruiseamerica.com/getattachment/b385adfc-50fd-4233-83ad-7d544ab102d6/attachment.aspx
